id,name,group,actor_1_facebook_likes,actor_2_facebook_likes,actor_3_facebook_likes,director_facebook_likes,imdb_score238,"GulliversTravels, director: Rob Letterman",Adventure Fantasy,480,392,116,11,4.93780,"AlexandersRagtimeBand, director: Henry King",Drama,480,392,300,85,72561,"TheLastGodfather, director: Hyung-rae Shim",Comedy Drama,898,391,385,26,3.63594,"Adam, director: Max Mayer",Drama,828,390,194,6,7.21278,"HotTubTimeMachine, director: Steve Pink",Comedy,496,390,318,38,6.41419,"TheReader, director: Stephen Daldry",Drama,14000,388,50,335,7.63117,"TheManwiththeGoldenGun, director: Guy Hamilton",Adventure Action,16000,387,244,82,6.8953,"TheBigBounce, director: George Armitage",Comedy Drama,11000,387,338,5,4.92884,"Spider, director: David Cronenberg",Thriller Drama,530,387,258,0,6.8876,"Congo, director: Frank Marshall",Adventure Action,426,387,293,155,52603,"Faithful, director: Paul Mazursky",Comedy Drama,979,385,150,150,5.93380,"ZeroEffect, director: Jake Kasdan",Thriller Drama,624,385,102,52,72024,"GhostShip, director: Steve Beck",Horror,534,385,78,17,5.54123,"After, director: Ryan Smith",Horror,523,385,258,4,5.42373,"Twins, director: Ivan Reitman",Comedy Drama,742,384,247,425,63538,"GonewiththeWind, director: Victor Fleming",Drama,503,384,248,149,8.2533,"Jarhead, director: Sam Mendes",Drama,15000,383,210,0,7.12955,"Detention, director: Joseph Kahn",Horror,14000,383,123,33,5.84054,"SnowWhiteADeadlySummer, director: David DeCoteau",Horror,458,383,317,142,2.21200,"TheImpossible, director: J.A. Bayona",Thriller Drama,6000,382,284,171,7.61396,"TheAgeofInnocence, director: Martin Scorsese",Drama,554,382,94,17000,7.23853,"Songcatcher, director: Maggie Greenwald",Drama,767,380,280,9,7.32341,"TheThirteenthFloor, director: Josef Rusnak",Thriller Drama,599,380,363,9,7634,"TheLongKissGoodnight, director: Renny Harlin",Thriller Drama,394,380,263,212,6.73712,"GardenState, director: Zach Braff",Comedy Drama,625,379,294,0,7.62092,"MrsHendersonPresents, director: Stephen Frears",Comedy Drama,5000,378,99,350,7.11582,"TheGoodThief, director: Neil Jordan",Thriller Drama,2000,378,345,277,6.63222,"AMightyWind, director: Christopher Guest",Comedy Drama,658,378,345,378,7.33277,"Crossover, director: Preston A. Whitmore II",Action,592,378,255,17,2.14216,"Maniac, director: Franck Khalfoun",Horror,470,378,118,33,6.11776,"ToraToraTora, director: Richard Fleischer",Drama,469,377,288,130,7.53625,"RedRiver, director: Howard Hawks",Adventure Action,862,376,281,393,7.82852,"BodyDouble, director: Brian De Palma",Thriller Drama,537,376,298,0,6.82225,"BlowOut, director: Brian De Palma",Thriller Drama,517,376,101,0,7.44302,"ArchaeologyofaWoman, director: Sharon Greytak",Drama,433,375,178,0,8.12984,"Undiscovered, director: Meiert Avis",Comedy Drama,922,374,230,0,4.21804,"MySoultoTake, director: Wes Craven",Horror,798,374,255,0,4.82054,"UndertheRainbow, director: Steve Rash",Comedy Drama,691,374,281,15,5.43462,"Paa, director: R. Balki",Comedy Drama,464,374,106,12,7.23999,"TheSessions, director: Ben Lewin",Comedy Drama,422,374,365,20,7.21216,"Sunshine, director: Danny Boyle",Adventure Action,11000,372,167,0,7.33942,"DaSweetBloodofJesus, director: Spike Lee",Comedy,3000,372,161,0,4.1203,"ThethWarrior, director: John McTiernan",Adventure Action,845,372,241,323,6.63557,"TheBalladofCableHogue, director: Sam Peckinpah",Comedy Drama,575,372,242,541,7.31211,"RaisetheTitanic, director: Jerry Jameson",Adventure Action,521,372,249,5,4.72854,"DirtyPrettyThings, director: Stephen Frears",Thriller Drama,460,372,250,350,7.41729,"TheUntouchables, director: Brian De Palma",Thriller Drama,22000,371,188,0,7.94067,"BansheeChapter, director: Blair Erickson",Horror,696,371,302,0,5.54133,"WaterPower, director: Richard Montoya",Drama,601,371,359,12,6.33922,"BatmanTheMovie, director: Leslie H. Martinson",Family,1000,370,356,7,6.5143,"Ghostbusters, director: Paul Feig",Comedy,783,370,322,176,5.53695,"DonovansReef, director: John Ford",Comedy,756,370,359,673,6.91063,"FindingForrester, director: Gus Van Sant",Drama,670,370,225,835,7.3753,"IntheNameoftheKingADungeonSiegeTale, director: Uwe Boll",Adventure Action,26000,368,102,892,3.840,"GreenLantern, director: Martin Campbell",Adventure Action,16000,368,326,258,5.61185,"TheIslandofDrMoreau, director: John Frankenheimer",Horror,10000,368,44,287,4.42993,"SkinTrade, director: Ekachai Uekrongtham",Action,2000,368,305,3,5.7246,"SpeedCruiseControl, director: Jan de Bont",Thriller Drama,673,368,202,101,3.71490,"Babe, director: Chris Noonan",Comedy Family,405,368,204,108,6.82138,"DylanDogDeadofNight, director: Kevin Munroe",Horror,403,368,311,14,5.12056,"SimonBirch, director: Mark Steven Johnson",Comedy Family,1000,367,271,160,6.9823,"Lolita, director: Stanley Kubrick",Drama,617,367,177,0,7.71371,"FlightoftheIntruder, director: John Milius",Thriller Drama,605,367,150,468,5.71977,"Jaws, director: Jeannot Szwarc",Horror,813,366,85,82,5.73651,"LovesAbidingJoy, director: Michael Landon Jr.",Drama,702,366,331,84,7.24063,"FearClinic, director: Robert Hall",Horror,677,366,253,53,5.24314,"Aroused, director: Deborah Anderson",Documentary,502,366,232,4,5.3211,"JasonBourne, director: Paul Greengrass",Action,13000,365,265,521,7.14191,"PoultrygeistNightoftheChickenDead, director: Lloyd Kaufman",Horror,907,365,49,365,6.23543,"FourLions, director: Christopher Morris",Comedy Drama,414,365,106,69,7.31125,"TheLastoftheMohicans, director: Michael Mann",Drama,855,363,322,0,7.82565,"SavetheLastDance, director: Thomas Carter",Drama,656,363,237,49,6.13781,"MeandYouandEveryoneWeKnow, director: Miranda July",Comedy Drama,538,363,244,244,7.43020,"YouGotServed, director: Chris Stokes",Drama,389,363,360,548,3.51032,"Dune, director: David Lynch",Adventure Action,913,362,202,0,6.61976,"JackassD, director: Jeff Tremaine",Comedy,608,362,218,79,7.12728,"JackassNumberTwo, director: Jeff Tremaine",Comedy,608,362,218,79,7.13310,"JackassTheMovie, director: Jeff Tremaine",Documentary,608,362,218,79,6.62778,"SeptemberDawn, director: Christopher Cain",Drama,482,362,258,58,5.82900,"Rosewater, director: Jon Stewart",Drama,374,362,241,593,6.64041,"TheHelixLoaded, director: A. Raven Cruz",Adventure Action,639,361,94,0,1.92421,"BoogieNights, director: Paul Thomas Anderson",Drama,3000,360,170,0,7.91987,"TheLastSong, director: Julie Anne Robinson",Drama,742,360,318,30,5.8231,"FantasticFour, director: Josh Trank",Adventure Action,596,360,78,128,4.31466,"TheVow, director: Michael Sucsy",Drama,17000,359,281,23,6.81442,"Bogus, director: Norman Jewison",Comedy Family,3000,359,179,278,5.32592,"DirtyWork, director: Bob Saget",Comedy Drama,721,359,294,799,6.41306,"GuessWho, director: Kevin Rodney Sullivan",Comedy Drama,1000,358,278,8,5.9209,"LifeofPi, director: Ang Lee",Drama,774,358,341,0,83159,"TheHeartofMe, director: Thaddeus O'Sullivan",Drama,766,358,52,5,6.7586,"TheLegendofHercules, director: Renny Harlin",Adventure Action,576,358,182,212,4.23320,"ParanormalActivityTheMarkedOnes, director: Christopher Landon",Horror,510,358,332,52,51167,"TheGuiltTrip, director: Anne Fletcher",Comedy Drama,405,358,78,98,5.82276,"ANightattheRoxbury, director: John Fortenberry",Comedy Drama,8000,357,281,12,6.23802,"Teeth, director: Mitchell Lichtenstein",Horror,386,357,268,53,5.43451,"Blackthorn, director: Mateo Gil",Adventure Action,820,356,327,3,6.63852,"BattleforthePlanetoftheApes, director: J. Lee Thompson",Action,595,356,196,88,5.53810,"ThisThingofOurs, director: Danny Provenzano",Drama,584,356,267,84,5.43564,"ShestheOne, director: Edward Burns",Comedy Drama,385,356,111,0,6.12509,"BrokenHorses, director: Vidhu Vinod Chopra",Thriller Drama,892,355,277,34,5.73759,"Sharkskin, director: Dan Perri",Thriller Drama,749,354,338,0,6.72857,"SeekingaFriendfortheEndoftheWorld, director: Lorene Scafaria",Drama,7000,353,172,63,6.72497,"ShinjukuIncident, director: Tung-Shing Yee",Thriller Drama,556,353,19,3,7.11154,"TheSkeletonKey, director: Iain Softley",Horror,545,351,280,34,6.51369,"Bait, director: Kimble Rendall",Action,465,351,174,0,5.23638,"DaysofHeaven, director: Terrence Malick",Drama,820,350,180,0,82574,"TheShallows, director: Jaume Collet-Serra",Horror,619,350,2,174,6.83964,"BleedingHearts, director: Dylan Bank",Horror,498,350,312,0,4.21111,"TheSocialNetwork, director: David Fincher",Drama,10000,349,81,21000,7.71081,"LicencetoKill, director: John Glen",Adventure Action,683,349,275,46,6.61529,"MortalKombatAnnihilation, director: John R. Leonetti",Adventure Action,663,349,342,40,3.71880,"TheNakedGunTheSmellofFear, director: David Zucker",Comedy Drama,3000,348,144,119,6.81640,"LostSouls, director: Janusz Kaminski",Horror,497,347,258,710,4.83865,"HappyTexas, director: Mark Illsley",Comedy Drama,349,347,327,3,6.33534,"HowtoFallinLove, director: Mark Griffiths",Comedy Drama,637,346,271,4,6.3624,"TheDictator, director: Larry Charles",Comedy Drama,600,346,174,119,6.41740,"FinalDestination, director: James Wong",Horror,440,346,318,70,5.84308,"Tadpole, director: Gary Winick",Comedy Drama,376,346,184,56,6.31879,"BadBoys, director: Michael Bay",Thriller Drama,10000,345,244,0,6.82582,"NoGoodDeed, director: Sam Miller",Thriller Drama,1000,345,334,12,5.61450,"MrHollandsOpus, director: Stephen Herek",Drama,975,345,320,65,7.3394,"TheCore, director: Jon Amiel",Adventure Action,894,345,106,36,5.42711,"Trade, director: Marco Kreuzpaintner",Thriller Drama,662,345,289,7,7.53428,"WithoutMen, director: Gabriela Tagliavini",Comedy Drama,571,345,329,20,3.23025,"ModernProblems, director: Ken Shapiro",Comedy,484,345,213,2,5730,"TheRelic, director: Peter Hyams",Horror,510,344,308,0,5.71486,"AboutSchmidt, director: Alexander Payne",Comedy Drama,442,344,322,729,7.23131,"ASingleMan, director: Tom Ford",Drama,14000,343,292,192,7.61563,"FrightNight, director: Craig Gillespie",Horror,596,343,133,44,6.42953,"FiddlerontheRoof, director: Norman Jewison",Comedy Family,402,343,51,278,82869,"RescueDawn, director: Werner Herzog",Drama,23000,342,294,0,7.3956,"StreetFighterTheLegendofChunLi, director: Andrzej Bartkowiak",Thriller Drama,841,342,77,43,3.73024,"ThatAwkwardMoment, director: Tom Gormican",Comedy Drama,363,342,117,19,6.12228,"AndSoItGoes, director: Rob Reiner",Comedy Drama,712,341,197,0,5.73637,"HeadsinaDuffelBag, director: Tom Schulman",Comedy Drama,578,341,267,45,5.32380,"Mama, director: AndrÃŒÂ©s Muschietti",Horror,1000,340,250,127,6.23126,"HouseofCorpses, director: Rob Zombie",Horror,1000,340,303,0,6493,"Hairspray, director: Adam Shankman",Comedy Family,719,339,260,163,6.73309,"CloverfieldLane, director: Dan Trachtenberg",Horror,14000,338,82,16,7.34122,"TheHadzaLastoftheFirst, director: Bill Benenson",Documentary,1000,338,21,0,7.43274,"StiffUpperLips, director: Gary Sinyor",Comedy Drama,722,338,136,0,6.44243,"GraduationDay, director: Herb Freed",Horror,431,338,180,5,4.51338,"ThePianist, director: Roman Polanski",Drama,396,338,95,2000,8.53403,"TheCottage, director: Paul Andrew Williams",Horror,570,337,141,46,6.2997,"MissCongeniality, director: Donald Petrie",Comedy,545,337,213,80,6.269,"SuicideSquad, director: David Ayer",Comedy,10000,336,329,452,6.91629,"HocusPocus, director: Kenny Ortega",Comedy Family,580,336,115,197,6.72133,"Steamboy, director: Katsuhiro ÃŒÃ“tomo",Adventure Action,488,336,101,78,6.92800,"TheBoy, director: William Brent Bell",Horror,4000,334,130,19,63796,"InsideDeepThroat, director: Fenton Bailey",Documentary,373,334,218,13,6.8698,"Hellboy, director: Guillermo del Toro",Action,366,334,160,0,6.84060,"TruthorDie, director: Robert Heath",Horror,335,334,177,0,5.63164,"TheBoondockSaints, director: Troy Duffy",Action,12000,333,184,78,7.93358,"SolomonandSheba, director: King Vidor",Drama,746,333,70,54,6.22018,"TexasChainsawD, director: John Luessenhop",Horror,383,333,322,34,4.82050,"Psycho, director: Alfred Hitchcock",Horror,606,332,285,13000,8.53023,"Shutter, director: Masayuki Ochiai",Horror,449,332,297,5,5.23603,"ParanormalActivity, director: Tod Williams",Horror,438,332,189,21,5.7307,"TheCampaign, director: Jay Roach",Comedy Drama,8000,331,329,116,6.23953,"BlueLikeJazz, director: Steve Taylor",Comedy Drama,1000,330,274,14,62529,"TeawithMussolini, director: Franco Zeffirelli",Comedy Drama,718,330,55,160,6.92742,"RaisingCain, director: Brian De Palma",Thriller Drama,636,330,298,0,6664,"WildHogs, director: Walt Becker",Comedy,419,330,311,12,5.92893,"MyBlueberryNights, director: Kar-Wai Wong",Drama,20000,329,20,0,6.71319,"NeighborsSororityRising, director: Nicholas Stoller",Comedy Drama,17000,329,190,89,61572,"AnUnfinishedLife, director: Lasse HallstrÃŒÂ_m",Drama,11000,329,83,529,73632,"Water, director: Deepa Mehta",Drama,1000,329,31,375,7.82651,"ProjectX, director: Nima Nourizadeh",Comedy Drama,971,329,281,166,6.7749,"DarkWater, director: Walter Salles",Horror,794,329,87,179,5.62549,"TheLuckyOnes, director: Neil Burger",Comedy Drama,697,329,322,168,73085,"MenwithBrooms, director: Paul Gross",Comedy Drama,611,329,280,329,6925,"TheHost, director: Andrew Niccol",Adventure Action,430,329,201,487,5.92417,"TheCraft, director: Andrew Fleming",Horror,838,328,266,26,6.23566,"EvilDeadII, director: Sam Raimi",Horror,634,328,199,0,7.83206,"Fahrenheit, director: Michael Moore",Documentary,503,328,282,909,7.51364,"HotPursuit, director: Anne Fletcher",Comedy,472,328,253,98,5.12686,"ProjectAlmanac, director: Dean Israelite",Thriller Drama,452,328,265,16,6.4573,"UnderworldAwakening, director: MÃŒÂ´ns MÃŒÂ´rlind",Action,5000,327,324,24,6.41639,"WeOwntheNight, director: James Gray",Thriller Drama,3000,327,97,115,6.92706,"Ondine, director: Neil Jordan",Drama,845,327,289,277,6.84164,"LonesomeJim, director: Steve Buscemi",Comedy Drama,778,327,213,12000,6.62296,"BobbyJonesStrokeofGenius, director: Rowdy Herrington",Drama,767,327,193,9,6.71913,"TheNet, director: Irwin Winkler",Thriller Drama,649,327,287,34,5.83649,"Compadres, director: Enrique Begne",Comedy,574,327,165,0,5582,"Blackhat, director: Michael Mann",Thriller Drama,26000,326,301,0,5.42385,"TheWomaninBlack, director: James Watkins",Horror,11000,326,259,43,6.42338,"HowtoDeal, director: Clare Kilner",Comedy Drama,812,326,258,6,5.72598,"BirthdayGirl, director: Jez Butterworth",Comedy,567,326,258,16,6.14170,"KisstheBride, director: C. Jay Cox",Comedy Drama,396,326,325,6,5.72547,"Amen, director: Costa-Gavras",Drama,380,326,284,333,7.33660,"JustLooking, director: Jason Alexander",Comedy Drama,599,325,56,700,6.7965,"PanicRoom, director: David Fincher",Thriller Drama,17000,324,237,21000,6.83418,"SlingBlade, director: Billy Bob Thornton",Drama,3000,324,263,0,82481,"TheClanoftheCaveBear, director: Michael Chapman",Drama,876,324,90,70,5.32876,"Malone, director: Harley Cokeliss",Thriller Drama,754,324,311,4,5.63889,"RepoMan, director: Alex Cox",Comedy,752,324,166,92,6.93648,"HobowithaShotgun, director: Jason Eisener",Comedy,694,324,104,59,6.13633,"Whipped, director: Peter M. Cohen",Comedy Drama,472,324,51,0,4.42446,"Confidence, director: James Foley",Thriller Drama,436,324,308,164,6.72824,"InvasionUSA, director: Joseph Zito",Action,371,324,53,17,5.3578,"BallisticEcksvsSever, director: Wych Kaosayananda",Action,349,324,298,8,3.63273,"TradeofInnocents, director: Christopher M. Bessette",Thriller Drama,978,323,57,0,5.42630,"CasinoJack, director: George Hickenlooper",Comedy Drama,18000,322,168,60,6.22793,"JeepersCreepers, director: Victor Salva",Horror,1000,322,270,108,6.11184,"TheOutofTowners, director: Sam Weisman",Comedy Drama,607,322,210,39,5.34330,"HollywoodShuffle, director: Robert Townsend",Comedy Drama,467,322,287,467,73884,"KissingJessicaStein, director: Charles Herman-Wurmfeld",Comedy Drama,378,321,117,0,6.72631,"TheLandBeforeTime, director: Don Bluth",Animation,912,320,191,383,7.34119,"Adulterers, director: H.M. Coakley",Thriller Drama,696,320,137,0,4.94258,"TeethandBlood, director: Al Franklin",Horror,471,320,270,0,4.32965,"BlackChristmas, director: Glen Morgan",Horror,607,318,179,17,4.53656,"TimandEricsBillionDollarMovie, director: Tim Heidecker",Comedy Drama,536,317,197,78,5.3631,"PrimaryColors, director: Mike Nichols",Comedy Drama,509,317,210,0,6.74242,"AndersonsCross, director: Jerome Elston Scott",Comedy Drama,500,317,248,3,7.24181,"Subconscious, director: Georgia Hilton",Thriller Drama,358,317,152,406,2.23411,"DyingoftheLight, director: Paul Schrader",Thriller Drama,12000,316,179,261,4.42350,"TheImmigrant, director: James Gray",Drama,10000,316,310,115,6.63957,"GrandTheftParsons, director: David Caffrey",Drama,690,316,95,4,6.11378,"KnockOff, director: Hark Tsui",Comedy,635,316,105,85,4.81251,"RockStar, director: Stephen Herek",Drama,628,316,108,65,6.22419,"RamonaandBeezus, director: Elizabeth Allen Rosenbaum",Adventure Fantasy,512,316,125,20,6.71498,"WithoutaPaddle, director: Steven Brill",Comedy,506,316,246,65,5.9148,"RiseoftheGuardians, director: Peter Ramsey",Animation,20000,315,161,52,7.31567,"DragonballEvolution, director: James Wong",Adventure Action,473,315,99,70,2.73028,"OnHerMajestysSecretService, director: Peter R. Hunt",Adventure Action,803,314,244,13,6.83819,"FreezeFrame, director: John Simpson",Thriller Drama,766,312,268,0,6.41094,"TheMedallion, director: Gordon Chan",Comedy,687,312,96,4,5.22192,"MyBigFatGreekWedding, director: Kirk Jones",Comedy Family,567,312,261,52,6.13343,"MyBigFatGreekWedding, director: Joel Zwick",Comedy Family,567,312,249,38,6.62254,"RedSonja, director: Richard Fleischer",Adventure Action,444,312,183,130,52048,"Appaloosa, director: Ed Harris",Drama,10000,311,107,0,6.8423,"Robots, director: Chris Wedge",Mixed,1000,311,208,77,6.31921,"DeliveryMan, director: Ken Scott",Comedy Drama,390,311,110,31,6.42420,"TheRemainsoftheDay, director: James Ivory",Drama,12000,310,258,133,7.92347,"Highlander, director: Russell Mulcahy",Adventure Action,1000,309,186,85,7.23710,"KevinHartLetMeExplain, director: Leslie Small",Documentary,1000,309,36,15,6.7541,"Shrek, director: Andrew Adamson",Animation,692,309,48,80,7.23398,"TheVisit, director: M. Night Shyamalan",Horror,432,309,99,0,6.24355,"Gabriela, director: Bruno Barreto",Comedy Drama,866,308,3,9,6.4202,"TotalRecall, director: Paul Verhoeven",Action,605,308,217,719,7.52161,"JustMarried, director: Shawn Levy",Comedy Drama,500,308,306,189,5.42433,"EyeoftheBeholder, director: Stephan Elliott",Thriller Drama,471,308,159,11,4.93760,"TheTimber, director: Anthony O'Brien",Drama,412,308,106,7,5.53238,"MissMarch, director: Zach Cregger",Comedy Drama,373,308,263,138,5.1468,"ASoundofThunder, director: Peter Hyams",Action,1000,307,212,0,4.22269,"Sideways, director: Alexander Payne",Drama,912,306,284,729,7.52253,"Renaissance, director: Christian Volckman",Action,805,306,69,2,6.73061,"TheLandGirls, director: David Leland",Drama,735,306,227,2,6.32610,"AttacktheBlock, director: Joe Cornish",Comedy,1000,305,304,115,6.63980,"Unfriended, director: Levan Gabriadze",Horror,707,305,142,6,5.72354,"Good, director: Vicente Amorim",Drama,10000,304,227,6,6.21030,"JohnnyEnglish, director: Peter Howitt",Comedy,427,304,252,29,6.1513,"FirstKnight, director: Jerry Zucker",Adventure Action,919,303,249,109,5.91651,"Octopussy, director: John Glen",Adventure Action,594,303,293,46,6.63282,"ChariotsofFire, director: Hugh Hudson",Drama,368,303,249,46,7.2718,"GangsterSquad, director: Ruben Fleischer",Thriller Drama,33000,301,300,181,6.7248,"LiveFreeorDieHard, director: Len Wiseman",Adventure Action,13000,300,297,235,7.22974,"TheIcePirates, director: Stewart Raffill",Comedy,1000,300,297,12,5.7158,"Hulk, director: Ang Lee",Action,820,300,258,0,5.74004,"MarthaMarcyMayMarlene, director: Sean Durkin",Thriller Drama,321,300,287,46,6.91175,"FeverPitch, director: Bobby Farrelly",Comedy Drama,787,299,223,101,6.2755,"TheGreatRaid, director: John Dahl",Drama,11000,298,242,131,6.73458,"FalconRising, director: Ernie Barbarash",Adventure Action,2000,298,261,249,5.81389,"FemmeFatale, director: Brian De Palma",Thriller Drama,548,298,115,0,6.32364,"Slither, director: James Gunn",Horror,499,298,102,571,6.5906,"IntotheStorm, director: Steven Quale",Action,490,298,159,77,5.83659,"ChainLetter, director: Deon Taylor",Horror,487,298,236,26,4.14031,"ThePerfectHost, director: Nick Tomnay",Comedy,443,298,271,11,6.83777,"GentlemansAgreement, director: Elia Kazan",Drama,936,297,167,603,7.42030,"OneMissedCall, director: Eric Valette",Horror,741,297,270,2,3.94277,"AlongtheRoadside, director: Zoran Lisinac",Comedy Drama,431,297,142,0,7.12873,"TheLimey, director: Steven Soderbergh",Thriller Drama,402,296,132,0,7.11868,"TheWiz, director: Sidney Lumet",Adventure Fantasy,738,295,227,0,5.23958,"ExtremeMovie, director: Adam Jay Epstein",Comedy Drama,387,295,227,0,3.8777,"ForrestGump, director: Robert Zemeckis",Comedy Drama,15000,294,194,0,8.82483,"FunnyGames, director: Michael Haneke",Horror,6000,294,287,0,6.53147,"WeNeedtoTalkAboutKevin, director: Lynne Ramsay",Thriller Drama,3000,294,77,159,7.53284,"Shine, director: Scott Hicks",Drama,509,294,35,96,7.7901,"TheGame, director: David Fincher",Thriller Drama,495,294,283,21000,7.8296,"SonoftheMask, director: Lawrence Guterman",Comedy Family,490,294,227,6,2.23571,"TheMaskedSaint, director: Warren P. Sonoda",Adventure Fantasy,426,294,131,28,4.72116,"AloneintheDark, director: Uwe Boll",Horror,310,294,81,892,2.3229,"DantesPeak, director: Roger Donaldson",Adventure Action,650,293,268,79,5.82746,"BarryLyndon, director: Stanley Kubrick",Drama,385,293,111,0,8.13717,"RobotFrank, director: Jake Schreier",Drama,902,291,215,14,7.11538,"DumbandDumbererWhenHarryMetLloyd, director: Troy Miller",Comedy Drama,577,291,244,14,3.4745,"Supernova, director: Walter Hill",Horror,889,290,68,394,4.82244,"Restoration, director: Zack Ward",Horror,662,290,161,662,42940,"ReKill, director: Valeri Milev",Action,557,290,200,6,5.13036,"BonCopBadCop, director: Erik Canuel",Comedy,539,290,50,31,73384,"RabbitHole, director: John Cameron Mitchell",Drama,967,289,192,263,72355,"EntertheVoid, director: Gaspar NoÃŒÂ©",Drama,488,289,116,929,7.3907,"BeverlyHillsCopIII, director: John Landis",Comedy,437,289,174,644,5.53247,"TheWildBunch, director: Sam Peckinpah",Adventure Action,682,288,242,541,84042,"InHerLineofFire, director: Brian Trenchard-Smith",Drama,563,288,176,53,4.12301,"EscobarParadiseLost, director: Andrea Di Stefano",Thriller Drama,14000,287,55,30,6.63978,"TheSleepwalker, director: Mona Fastvold",Drama,321,287,9,2,4.91635,"PridePrejudice, director: Joe Wright",Drama,422,286,241,456,7.82062,"PoohsHeffalumpMovie, director: Frank Nissen",Animation,304,286,253,0,6.41692,"RedEye, director: Wes Craven",Thriller Drama,332,285,178,0,6.51247,"AngelEyes, director: Luis Mandoki",Drama,308,285,280,43,5.61873,"MeettheDeedles, director: Steve Boyum",Comedy Family,23000,284,254,9,3.93829,"Highway, director: James Cox",Drama,15000,284,171,10,6.390,"TerminatorRiseoftheMachines, director: Jonathan Mostow",Action,648,284,191,84,6.43278,"Khiladi, director: Ashish R. Mohan",Comedy,634,284,61,2,4.31276,"Breakdown, director: Jonathan Mostow",Thriller Drama,551,284,263,84,6.93748,"TheValleyofDecision, director: Tay Garnett",Drama,509,284,275,10,7.5185,"Australia, director: Baz Luhrmann",Drama,309,284,165,1000,6.63101,"PoundofFlesh, director: Ernie Barbarash",Action,294,284,96,249,5.14011,"BubbaHoTep, director: Don Coscarelli",Comedy,1000,282,124,152,7.24051,"Proud, director: Mary Pat Kelly",Drama,767,282,149,3,5.84117,"NaturallyNative, director: Jennifer Wynne Farmer",Drama,752,282,236,0,6.52146,"DwegonsandLeprechauns, director: Tom Walsh",Comedy Family,729,282,53,2,4.83219,"SchoolDaze, director: Spike Lee",Comedy Drama,413,282,182,0,5.83306,"DumMaaroDum, director: Rohan Sippy",Thriller Drama,374,282,47,4,6.21948,"Firefox, director: Clint Eastwood",Adventure Action,16000,281,216,16000,5.92553,"Clueless, director: Amy Heckerling",Comedy Drama,927,281,201,143,6.83650,"Freeway, director: Matthew Bright",Thriller Drama,904,281,221,9,6.92722,"Gremlins, director: Joe Dante",Horror,767,281,233,287,7.22692,"FromJustintoKelly, director: Robert Iscove",Comedy Drama,525,281,251,7,2.12142,"TheTouch, director: Jane Clark",Short,344,281,51,23,5.21889,"TheCrew, director: Michael Dinner",Comedy Drama,327,281,249,12,5.63382,"LightSleeper, director: Paul Schrader",Drama,722,280,145,261,6.84172,"Monsters, director: Gareth Edwards",Thriller Drama,660,280,113,380,6.41018,"TheSpecialist, director: Luis Llosa",Thriller Drama,13000,279,20,49,5.44337,"Closure, director: Dan Reed",Thriller Drama,798,279,140,3,5.61390,"LionoftheDesert, director: Moustapha Akkad",Drama,695,279,249,278,8.43208,"MaryPoppins, director: Robert Stevenson",Comedy Family,382,279,266,55,7.82817,"TheDeadZone, director: David Cronenberg",Horror,1000,278,275,0,7.22480,"Transsiberian, director: Brad Anderson",Thriller Drama,918,278,25,122,6.73316,"TheReturnofthePinkPanther, director: Blake Edwards",Comedy,462,278,80,688,7.12237,"Megaforce, director: Hal Needham",Action,456,278,251,379,3.5451,"TheLegendofZorro, director: Martin Campbell",Adventure Action,2000,277,163,258,5.94223,"MyDogTulip, director: Paul Fierlinger",Drama,812,277,258,3,6.91294,"LethalWeapon, director: Richard Donner",Action,808,277,94,503,6.73679,"CloseRange, director: Isaac Florentine",Action,640,277,214,81,4.93037,"TheCityofYourFinalDestination, director: James Ivory",Drama,471,277,86,133,6.4560,"Wolf, director: Mike Nichols",Thriller Drama,443,277,184,0,6.24227,"Tumbleweeds, director: Gavin O'Connor",Comedy Drama,409,277,276,149,6.72506,"FatalAttraction, director: Adrian Lyne",Thriller Drama,886,276,249,213,6.92760,"InsideLlewynDavis, director: Ethan Coen",Drama,3000,275,272,1000,7.42795,"Oliver, director: Carol Reed",Comedy Family,695,275,139,82,7.53983,"DrNo, director: Terence Young",Adventure Action,650,275,177,92,7.33600,"ItsaWonderfulLife, director: Frank Capra",Comedy Family,488,275,248,964,8.6