id,name,group,actor_1_facebook_likes,actor_2_facebook_likes,actor_3_facebook_likes,director_facebook_likes,imdb_score1736,"NoStringsAttached, director: Ivan Reitman",Comedy Drama,20000,962,766,425,6.2758,"AmericanSniper, director: Clint Eastwood",Thriller Drama,14000,962,318,16000,7.3800,"TheForbiddenKingdom, director: Rob Minkoff",Adventure Action,5000,962,947,50,6.61548,"Mr, director: Charles Stone III",Comedy Drama,1000,962,635,30,5.52830,"ThePerfectMan, director: Mark Rosman",Comedy Family,1000,962,804,15,5.53042,"Prom, director: Joe Nussbaum",Comedy Drama,1000,962,741,18,5.43795,"MeeksCutoff, director: Kelly Reichardt",Drama,991,962,887,129,6.54030,"TheHouseoftheDevil, director: Ti West",Horror,969,962,725,243,6.4751,"TheSpirit, director: Frank Miller",Action,19000,961,437,436,4.8106,"PearlHarbor, director: Michael Bay",Drama,3000,961,691,0,6.11772,"BloodTies, director: Guillaume Canet",Thriller Drama,15000,960,745,0,6.5433,"TheHaunting, director: Jan de Bont",Horror,14000,960,913,101,4.92512,"MyBloodyValentine, director: Patrick Lussier",Horror,10000,960,725,71,5.53223,"MysticPizza, director: Donald Petrie",Comedy Drama,8000,960,658,80,6.21979,"TheConjuring, director: James Wan",Horror,6000,960,697,0,7.52288,"BrooklynsFinest, director: Antoine Fuqua",Thriller Drama,3000,960,625,847,6.71984,"WhiteChicks, director: Keenen Ivory Wayans",Comedy Drama,1000,960,861,322,5.42029,"HighFidelity, director: Stephen Frears",Comedy Drama,1000,960,619,350,7.61310,"InOut, director: Frank Oz",Comedy Drama,19000,957,945,0,6.31238,"TheUglyTruth, director: Robert Luketic",Comedy Drama,18000,957,954,126,6.5844,"TheBreakUp, director: Peyton Reed",Comedy Drama,4000,957,931,235,5.82596,"nan, director: Mark Christopher",Drama,4000,957,812,15,5.82152,"BadTeacher, director: Jake Kasdan",Comedy Drama,3000,957,384,52,5.71869,"ReadytoRumble, director: Brian Robbins",Comedy Drama,1000,957,940,48,5.31068,"TheMechanic, director: Simon West",Action,26000,956,350,165,6.61660,"KisstheGirls, director: Gary Fleder",Thriller Drama,11000,956,685,39,6.6149,"TheLastSamurai, director: Edward Zwick",Drama,10000,956,445,380,7.7351,"PercyJacksonSeaofMonsters, director: Thor Freudenthal",Adventure Fantasy,8000,956,918,87,5.91904,"Ghost, director: Jerry Zucker",Drama,2000,956,71,109,736,"TransformersAgeofExtinction, director: Michael Bay",Adventure Action,974,956,808,0,5.7606,"WhatWomenWant, director: Nancy Meyers",Comedy Drama,2000,955,912,278,6.4671,"DaddyDayCare, director: Steve Carr",Comedy Family,1000,955,522,41,5.5981,"FirstBlood, director: Ted Kotcheff",Adventure Action,13000,954,535,270,7.72646,"HaroldKumarEscapefromGuantanamoBay, director: Jon Hurwitz",Comedy,1000,954,816,22,6.62284,"SummerCatch, director: Michael Tollin",Comedy Drama,973,954,505,19,4.91553,"EightLeggedFreaks, director: Ellory Elkayem",Comedy,19000,953,762,11,5.489,"HowtoTrainYourDragon, director: Dean DeBlois",Animation,18000,953,759,255,8.21758,"TheSisterhoodoftheTravelingPants, director: Ken Kwapis",Comedy Family,2000,953,917,42,6.63257,"Julia, director: Fred Zinnemann",Drama,11000,949,898,160,7.41004,"MonsterinLaw, director: Robert Luketic",Comedy Drama,3000,949,586,126,5.51606,"TheJacket, director: John Maybury",Thriller Drama,1000,948,566,11,7.12930,"NurseD, director: Douglas Aarniokoski",Horror,1000,948,899,36,4.62944,"GentlemenBroncos, director: Jared Hess",Comedy,33000,947,327,100,6.11589,"WildCard, director: Simon West",Thriller Drama,26000,947,700,165,5.6365,"Seabiscuit, director: Gary Ross",Drama,12000,947,599,378,7.33505,"RedState, director: Kevin Smith",Action,1000,947,939,0,6.24078,"TheBrassTeapot, director: Ramaa Mosley",Comedy,975,947,727,6,6.4366,"Twister, director: Jan de Bont",Adventure Action,22000,946,848,101,6.31465,"Speed, director: Jan de Bont",Adventure Action,18000,946,780,101,7.2693,"TheHappening, director: M. Night Shyamalan",Thriller Drama,11000,946,751,0,51240,"StarTrekGenerations, director: David Carson",Adventure Action,1000,946,906,18,6.64177,"EverythingPutTogether, director: Marc Forster",Drama,991,946,637,395,6.61420,"Wanderlust, director: David Wain",Comedy Drama,1000,945,833,136,5.62356,"Vamps, director: Amy Heckerling",Comedy Drama,1000,945,613,143,5.12814,"CantHardlyWait, director: Harry Elfont",Comedy Drama,982,945,678,4,6.54125,"Walter, director: Anna Mastro",Comedy Drama,956,945,912,7,5.31202,"LifeorSomethingLikeIt, director: Stephen Herek",Comedy Drama,11000,944,311,65,5.82241,"AnythingElse, director: Woody Allen",Comedy Drama,11000,944,922,11000,6.4703,"UpClosePersonal, director: Jon Avnet",Drama,1000,944,672,50,6.13204,"Grease, director: Randal Kleiser",Comedy Family,1000,944,898,116,7.2186,"AfterEarth, director: M. Night Shyamalan",Adventure Action,10000,943,894,0,4.93253,"TheGreatest, director: Shana Feste",Drama,1000,943,71,19,6.71545,"Sanctum, director: Alister Grierson",Thriller Drama,2000,942,653,24,5.91908,"TheGamePlan, director: Andy Fickman",Comedy Family,12000,941,835,99,6.23151,"MotherandChild, director: Rodrigo GarcÃŒ_a",Drama,6000,941,798,127,7.21183,"BlesstheChild, director: Chuck Russell",Horror,3000,941,294,55,5.11422,"Phenomenon, director: Jon Turteltaub",Drama,3000,941,796,226,6.42106,"BattleoftheYear, director: Benson Lee",Drama,997,941,826,9,51195,"CityHall, director: Harold Becker",Thriller Drama,14000,940,889,17,6.22662,"Rounders, director: John Dahl",Drama,13000,940,599,131,7.4947,"Domino, director: Tony Scott",Thriller Drama,984,940,897,12000,61326,"MustLoveDogs, director: Gary David Goldberg",Comedy Drama,944,940,664,30,5.9734,"TheSoloist, director: Joe Wright",Drama,21000,939,569,456,6.71730,"NoCountryforOldMen, director: Ethan Coen",Thriller Drama,2000,939,883,1000,8.1314,"FindingNemo, director: Andrew Stanton",Animation,1000,939,799,475,8.2607,"IceAge, director: Chris Wedge",Animation,1000,939,835,77,7.62858,"CedarRapids, director: Miguel Arteta",Comedy Drama,1000,939,727,44,6.31471,"DodgeballATrueUnderdogStory, director: Rawson Marshall Thurber",Comedy Drama,989,939,936,43,6.72847,"OfficeSpace, director: Mike Judge",Comedy Drama,989,939,759,406,7.83751,"AlwaysWoodstock, director: Rita Merson",Comedy Drama,3000,938,782,5,5.32034,"YouAgain, director: Andy Fickman",Comedy Family,2000,938,518,99,5.81645,"ASimpleWish, director: Michael Ritchie",Comedy Family,1000,937,899,23,5.4695,"TheShaggyDog, director: Brian Robbins",Comedy Family,21000,936,722,48,4.41158,"TheRainmaker, director: Francis Ford Coppola",Thriller Drama,13000,936,913,0,7.13368,"GrandmasBoy, director: Nicholaus Goossen",Comedy Drama,2000,936,556,4,70,"Avatar, director: James Cameron",Adventure Action,1000,936,855,0,7.91810,"SharkNightD, director: David R. Ellis",Horror,963,936,852,160,4995,"Taken, director: Olivier Megaton",Action,14000,935,558,118,6.31118,"JulieJulia, director: Nora Ephron",Drama,11000,935,923,0,71104,"FiftyShadesofGrey, director: Sam Taylor-Johnson",Drama,1000,935,716,456,4.12534,"JasonX, director: James Isaac",Action,1000,935,489,52,4.41237,"SweetHomeAlabama, director: Andy Tennant",Comedy Drama,982,935,559,72,6.1765,"DidYouHearAbouttheMorgans, director: Marc Lawrence",Comedy Drama,963,935,727,30,4.73898,"Hatchet, director: Adam Green",Horror,936,935,488,134,5.7154,"GodsofEgypt, director: Alex Proyas",Adventure Action,18000,934,284,295,5.52568,"DudeWheresMyCar, director: Danny Leiner",Comedy,3000,934,612,8,5.52039,"ShesOutofMyLeague, director: Jim Field Smith",Comedy Drama,2000,934,756,14,6.41701,"AgentCodyBanksDestinationLondon, director: Kevin Allen",Mixed,1000,934,588,8,4.51748,"AgentCodyBanks, director: Harald Zwart",Comedy,1000,934,434,91,52041,"StayAlive, director: William Brent Bell",Horror,1000,934,806,19,5.13109,"MyDogSkip, director: Jay Russell",Drama,1000,934,430,13,71508,"RacingStripes, director: Frederik Du Chau",Comedy Family,984,934,521,7,5.23355,"SunshineCleaning, director: Christine Jeffs",Comedy Drama,968,934,260,19,6.93447,"DonnieDarko, director: Richard Kelly",Thriller Drama,15000,933,701,219,8.12826,"Rushmore, director: Wes Anderson",Comedy Drama,13000,933,766,0,7.7261,"Gladiator, director: Ridley Scott",Drama,3000,933,695,0,8.5356,"MissiontoMars, director: Brian De Palma",Adventure Action,3000,933,281,0,5.63955,"CertifiablyJonathan, director: James David Pasternak",Documentary,49000,931,924,0,6.22986,"VeronikaDecidestoDie, director: Emily Young",Drama,4000,931,664,6,6.51982,"SchoolofRock, director: Richard Linklater",Comedy Drama,2000,931,487,0,7.12006,"LakeviewTerrace, director: Neil LaBute",Thriller Drama,1000,931,332,119,6.12633,"TheExorcist, director: William Friedkin",Horror,1000,931,259,607,886,"WreckItRalph, director: Rich Moore",Mixed,975,931,833,66,7.82666,"TheUpsideofAnger, director: Mike Binder",Comedy Drama,975,931,805,57,6.92059,"SchoolforScoundrels, director: Todd Phillips",Comedy Drama,970,931,579,480,5.91186,"TheMusketeer, director: Peter Hyams",Adventure Action,964,931,327,0,4.72968,"TheSavages, director: Tamara Jenkins",Comedy Drama,22000,929,338,84,7.2244,"RealSteel, director: Shawn Levy",Drama,20000,929,544,189,7.11035,"Blocks, director: Richard Donner",Thriller Drama,13000,929,795,503,6.61649,"KickAss, director: Jeff Wadlow",Comedy,17000,927,405,65,6.63621,"NextDayAir, director: Benny Boom",Comedy,1000,927,706,23,5.92387,"BigFatLiar, director: Shawn Levy",Family,934,927,799,189,5.42827,"Skyline, director: Colin Strause",Action,929,927,861,25,4.44239,"DeathRace, director: Paul Bartel",Comedy,13000,926,668,43,6.22835,"TheLongRiders, director: Walter Hill",Comedy Family,2000,926,695,394,7.1651,"WyattEarp, director: Lawrence Kasdan",Drama,2000,925,812,759,6.62537,"FunSize, director: Josh Schwartz",Comedy,962,925,635,90,5.42690,"ForYourConsideration, director: Christopher Guest",Comedy Drama,957,925,783,378,6.33217,"BestinShow, director: Christopher Guest",Comedy Drama,957,925,658,378,7.51231,"Frankenweenie, director: Tim Burton",Mixed,940,925,787,13000,73175,"HouseattheEndoftheStreet, director: Mark Tonderai",Horror,34000,924,261,13,5.61254,"Riddick, director: David Twohy",Action,14000,924,904,123,6.41072,"AlongCamePolly, director: John Hamburg",Comedy Drama,22000,923,650,29,5.91109,"ALeagueofTheirOwn, director: Penny Marshall",Comedy Drama,15000,923,251,545,7.21834,"TankGirl, director: Rachel Talalay",Comedy,6000,923,919,54,5.2935,"ManoftheHouse, director: Stephen Herek",Comedy,1000,923,730,65,5.41084,"SuperMarioBros, director: Annabel Jankel",Mixed,5000,922,687,5,42991,"Awake, director: Joby Harold",Thriller Drama,4000,922,896,8,6.52906,"Edmond, director: Stuart Gordon",Thriller Drama,1000,922,885,216,6.33072,"Swelter, director: Keith Parmer",Thriller Drama,31000,920,600,2,4.6867,"JumpStreet, director: Phil Lord",Comedy,17000,920,584,97,7.11452,"OutofAfrica, director: Sydney Pollack",Drama,11000,920,184,521,7.2911,"ResidentEvilApocalypse, director: Alexander Witt",Action,14000,919,706,38,6.21281,"AManApart, director: F. Gary Gray",Thriller Drama,14000,919,582,473,6.1870,"CentralIntelligence, director: Rawson Marshall Thurber",Comedy,12000,919,569,43,6.6653,"U, director: Jonathan Mostow",Action,11000,919,563,84,6.62815,"TheOutsiders, director: Francis Ford Coppola",Drama,10000,919,699,0,7.224,"KingKong, director: Peter Jackson",Drama,6000,919,84,0,7.2310,"TheRoadtoElDorado, director: Bibo Bergeron",Animation,2000,919,442,10,6.939,"Cars, director: John Lasseter",Animation,1000,919,776,487,6.32172,"WontBackDown, director: Daniel Barnz",Drama,1000,919,505,33,6.41244,"Enough, director: Michael Apted",Thriller Drama,970,919,789,150,5.6595,"HallPass, director: Bobby Farrelly",Comedy Drama,966,919,681,101,5.91591,"UnitedPassions, director: FrÃŒÂ©dÃŒÂ©ric Auburtin",Drama,922,919,432,18,22257,"Wolves, director: David Hayter",Action,11000,918,413,512,5.33193,"TheEast, director: Zal Batmanglij",Thriller Drama,10000,918,782,129,6.92825,"RollBounce, director: Malcolm D. Lee",Comedy Drama,2000,918,826,92,61438,"AHistoryofViolence, director: David Cronenberg",Thriller Drama,10000,917,882,0,7.52043,"TheCovenant, director: Renny Harlin",Action,960,917,637,212,5.31343,"Mirrors, director: Alexandre Aja",Horror,1000,915,844,192,6.2652,"ClearandPresentDanger, director: Phillip Noyce",Thriller Drama,11000,913,672,176,6.92589,"TheAstronautFarmer, director: Michael Polish",Drama,24000,912,844,35,6.32822,"APrairieHomeCompanion, director: Robert Altman",Comedy Drama,11000,912,718,500,6.81434,"TheNumber, director: Joel Schumacher",Thriller Drama,8000,912,897,541,6.42874,"Crash, director: Paul Haggis",Thriller Drama,3000,912,911,549,7.91283,"GhostsofMississippi, director: Rob Reiner",Drama,2000,912,723,0,6.7892,"DontSayaWord, director: Gary Fleder",Thriller Drama,1000,912,477,39,6.31955,"ForColoredGirls, director: Tyler Perry",Drama,1000,912,637,0,62120,"Passchendaele, director: Paul Gross",Drama,1000,912,544,329,6.53111,"JumpingtheBroom, director: Salim Akil",Comedy Drama,1000,912,826,70,5.72515,"UrbanLegend, director: Jamie Blanks",Horror,975,912,648,9,5.51914,"IAmSam, director: Jessie Nelson",Drama,967,912,506,24,7.61835,"KingsRansom, director: Jeffrey W. Byrd",Comedy Drama,927,912,807,2,4.12281,"LotteryTicket, director: Erik White",Comedy Drama,918,912,826,17,4.9297,"IntheHeartoftheSea, director: Ron Howard",Adventure Action,26000,911,571,2000,71924,"SummerofSam, director: Spike Lee",Thriller Drama,978,911,854,0,6.61564,"TheNewWorld, director: Terrence Malick",Drama,23000,909,855,0,6.71858,"OldSchool, director: Todd Phillips",Comedy Drama,8000,909,497,480,7.22072,"CapitalismALoveStory, director: Michael Moore",News,1000,909,173,909,7.4640,"LuckyNumbers, director: Nora Ephron",Comedy Drama,975,909,506,0,52952,"TheRunaways, director: Floria Sigismondi",Drama,17000,908,741,50,6.61990,"WhyDidIGetMarriedToo, director: Tyler Perry",Comedy Drama,2000,907,721,0,4.42787,"MadeasFamilyReunion, director: Tyler Perry",Comedy Drama,1000,907,685,0,5378,"TowerHeist, director: Brett Ratner",Comedy,2000,906,535,420,6.22556,"SevenPsychopaths, director: Martin McDonagh",Comedy Drama,2000,906,816,454,7.2557,"StarTrekInsurrection, director: Jonathan Frakes",Adventure Action,1000,906,748,906,6.42973,"TheUltimateGift, director: Michael O. Sajbel",Drama,970,906,633,6,7.43045,"WomanonTop, director: Fina Torres",Comedy Drama,1000,905,417,26,5.32223,"YouthinRevolt, director: Miguel Arteta",Comedy Drama,12000,904,729,44,6.5656,"MilestoGraceland, director: Demian Lichtenstein",Comedy,11000,904,867,11,5.92078,"WhatsYourNumber, director: Mark Mylod",Comedy Drama,11000,904,783,20,61302,"IdentityThief, director: Seth Gordon",Comedy Drama,4000,904,680,91,5.72801,"Devil, director: John Erick Dowdle",Horror,2000,904,816,66,6.3481,"TheSecretLifeofPets, director: Yarrow Cheney",Animation,1000,904,745,11,6.84082,"ForaGoodTimeCall, director: Jamie Travis",Comedy Drama,938,904,567,15,61249,"TheNinthGate, director: Roman Polanski",Thriller Drama,40000,903,541,2000,6.71145,"Unknown, director: Jaume Collet-Serra",Thriller Drama,14000,903,767,174,6.9895,"Syriana, director: Stephen Gaghan",Thriller Drama,13000,903,414,79,7326,"CutthroatIsland, director: Renny Harlin",Comedy,1000,903,810,212,5.61592,"GraceofMonaco, director: Olivier Dahan",Drama,963,903,520,61,5.73011,"PulpFiction, director: Quentin Tarantino",Drama,13000,902,857,16000,8.92575,"TheButterflyEffect, director: Eric Bress",Thriller Drama,8000,902,829,19,7.73293,"HarvardMan, director: James Toback",Comedy Drama,4000,902,781,56,4.91013,"Anaconda, director: Luis Llosa",Action,2000,902,514,49,4.63658,"FortMcCoy, director: Kate Connor",Drama,1000,902,847,27,5.91961,"SwingVote, director: Joshua Michael Stern",Comedy Drama,1000,901,886,0,6.13438,"FastTimesatRidgemontHigh, director: Amy Heckerling",Comedy Drama,1000,901,811,143,7.21972,"BeverlyHillsCopII, director: Tony Scott",Comedy,936,901,605,12000,6.42608,"TheClaim, director: Michael Winterbottom",Drama,14000,900,887,187,6.51967,"eXistenZ, director: David Cronenberg",Horror,1000,900,716,0,6.82988,"TheIInside, director: Roland Suso Richter",Thriller Drama,1000,900,327,3,6.13374,"TheSweetHereafter, director: Atom Egoyan",Drama,990,900,395,460,7.73414,"ShouldveBeenRomeo, director: Marc Bennett",Comedy Drama,975,900,723,3,6.71121,"DumbandDumberTo, director: Bobby Farrelly",Comedy Drama,13000,899,839,101,5.72200,"PeggySueGotMarried, director: Francis Ford Coppola",Comedy Drama,12000,899,805,0,6.33236,"TheVirginSuicides, director: Sofia Coppola",Drama,4000,899,826,0,7.2662,"MarleyMe, director: David Frankel",Comedy Family,2000,899,664,64,7.11445,"CradleWillRock, director: Tim Robbins",Drama,13000,898,876,0,6.93191,"Shame, director: Steve McQueen",Drama,13000,898,726,0,7.3929,"EscapefromLA, director: John Carpenter",Adventure Action,12000,898,764,0,5.73046,"HowardsEnd, director: James Ivory",Drama,12000,898,136,133,7.53475,"LeavingLasVegas, director: Mike Figgis",Drama,12000,898,687,81,7.6179,"BadBoysII, director: Michael Bay",Comedy,10000,898,877,0,6.61713,"RainMan, director: Barry Levinson",Drama,10000,898,628,272,81260,"TheExpress, director: Gary Fleder",Drama,2000,898,534,39,7.32739,"HistoryoftheWorldPartI, director: Mel Brooks",Comedy Drama,1000,898,842,0,6.92927,"TheDevilsTomb, director: Jason Connery",Action,1000,898,711,110,3.83203,"Mallrats, director: Kevin Smith",Comedy Drama,1000,898,781,0,7.23326,"ClerksII, director: Kevin Smith",Comedy Drama,1000,898,657,0,7.42941,"ItsaMadMadMadMadWorld, director: Stanley Kramer",Comedy,924,898,760,176,7.6728,"TroublewiththeCurve, director: Robert Lorenz",Drama,16000,897,461,39,6.8127,"WrathoftheTitans, director: Jonathan Liebesman",Adventure Action,14000,897,502,473,5.8173,"TheBourneUltimatum, director: Paul Greengrass",Thriller Drama,13000,897,883,521,8.11128,"VantagePoint, director: Pete Travis",Thriller Drama,2000,897,882,38,6.6295,"PointBreak, director: Ericson Core",Action,1000,897,848,19,5.32317,"TheArtist, director: Michel Hazanavicius",Comedy Drama,996,897,628,405,81100,"TheProposal, director: Anne Fletcher",Comedy Drama,16000,896,723,98,6.72022,"Milk, director: Gus Van Sant",Drama,11000,896,755,835,7.61943,"MichaelClayton, director: Tony Gilroy",Thriller Drama,1000,896,521,209,7.31026,"TheRiverWild, director: Curtis Hanson",Adventure Action,11000,894,132,161,6.31226,"TheLastShot, director: Jeff Nathanson",Comedy Drama,2000,894,596,23,5.72165,"TheCrazies, director: Breck Eisner",Horror,991,894,219,42,6.5150,"ExodusGodsandKings, director: Ridley Scott",Adventure Action,23000,893,748,0,6.12891,"OwningMahowny, director: Richard Kwietniowski",Thriller Drama,22000,893,232,23,7.2815,"ThePhantomoftheOpera, director: Joel Schumacher",Drama,18000,893,530,541,7.41196,"Showgirls, director: Paul Verhoeven",Drama,16000,893,683,719,4.6579,"HardRain, director: Mikael Salomon",Thriller Drama,11000,893,695,13,5.81707,"TheCurseoftheJadeScorpion, director: Woody Allen",Comedy,11000,893,277,11000,6.82915,"Motherhood, director: Katherine Dieckmann",Comedy Drama,1000,893,495,8,4.71475,"TheFirstWivesClub, director: Hugh Wilson",Comedy Drama,944,893,452,37,6.23573,"Taxman, director: Avi Nesher",Comedy,922,893,467,6,5.53344,"SpringBreakers, director: Harmony Korine",Drama,11000,892,192,520,5.32979,"GleeTheDConcertMovie, director: Kevin Tancharoen",Documentary,2000,892,748,64,5.41380,"TheOrder, director: Brian Helgeland",Thriller Drama,13000,891,127,241,5.1761,"TheFlintstonesinVivaRockVegas, director: Brian Levant",Comedy Family,1000,891,809,32,3.62926,"ItsaWonderfulAfterlife, director: Gurinder Chadha",Comedy Drama,1000,891,95,98,5.43550,"TheFullMonty, director: Peter Cattaneo",Comedy Drama,1000,891,121,11,7.21489,"DowntoEarth, director: Chris Weitz",Comedy,979,891,560,129,5.42586,"TwoCanPlayThatGame, director: Mark Brown",Comedy Drama,939,890,405,7,6.1205,"BatmanRobin, director: Joel Schumacher",Action,920,890,409,541,3.72475,"MulhollandDrive, director: David Lynch",Thriller Drama,6000,889,669,0,8520,"Monkeybone, director: Henry Selick",Animation,3000,889,637,253,4.71504,"LikeMike, director: John Schultz",Comedy Family,1000,889,837,13,5.12495,"Automata, director: Gabe IbÃŒÃÅÃŒÂ±ez",Action,1000,889,537,19,6.11759,"KissoftheDragon, director: Chris Nahon",Thriller Drama,5000,888,872,20,6.61665,"LakePlacid, director: Steve Miner",Comedy,1000,888,429,49,5.62285,"ASimplePlan, director: Sam Raimi",Thriller Drama,989,888,244,0,7.52754,"ArmyofDarkness, director: Sam Raimi",Horror,901,888,795,0,7.61197,"MarieAntoinette, director: Sofia Coppola",Drama,4000,887,826,0,6.43601,"Trainspotting, director: Danny Boyle",Drama,2000,887,557,0,8.22939,"PoltergeistIII, director: Gary Sherman",Horror,1000,887,770,17,4.53421,"TristramShandyACockandBullStory, director: Michael Winterbottom",Comedy Drama,1000,887,427,187,6.83449,"LifeDuringWartime, director: Todd Solondz",Comedy Drama,1000,887,844,377,6.5912,"OutofTime, director: Carl Franklin",Thriller Drama,18000,886,323,73,6.5393,"MirrorMirror, director: Tarsem Singh",Adventure Fantasy,8000,886,809,763,5.6471,"TheLionKing, director: Roger Allers",Animation,2000,886,847,28,8.52273,"TheBestManHoliday, director: Malcolm D. Lee",Comedy Drama,1000,886,849,92,6.72957,"TheBestMan, director: Malcolm D. Lee",Comedy Drama,1000,886,862,92,6.73022,"BrownSugar, director: Rick Famuyiwa",Comedy Drama,1000,886,458,44,6.5255,"StuartLittle, director: Rob Minkoff",Adventure Fantasy,979,886,692,50,5.91193,"AtFirstSight, director: Irwin Winkler",Drama,978,886,685,34,5.92719,"PetSematary, director: Mary Lambert",Horror,969,886,426,52,6.61287,"IsntSheGreat, director: Andrew Bergman",Comedy Drama,944,886,450,31,5.3364,"TheNutcrackerinD, director: Andrey Konchalovskiy",Adventure Fantasy,887,886,554,96,4.4700,"ParaNorman, director: Chris Butler",Animation,10000,884,586,28,72007,"TheGrudge, director: Takashi Shimizu",Horror,4000,884,464,70,52713,"BreakfastofChampions, director: Alan Rudolph",Comedy Drama,13000,883,865,18,4.62460,"AMightyHeart, director: Michael Winterbottom",Thriller Drama,11000,883,254,187,6.7865,"ErinBrockovich, director: Steven Soderbergh",Drama,8000,883,658,0,7.32641,"WarGames, director: John Badham",Thriller Drama,2000,883,793,139,7.11966,"TheBestLittleWhorehouseinTexas, director: Colin Higgins",Comedy Drama,1000,883,842,19,5.81385,"AGoodYear, director: Ridley Scott",Comedy Drama,883,883,567,0,6.9746,"WintersTale, director: Akiva Goldsman",Drama,20000,882,778,167,6.22058,"IntotheWild, director: Sean Penn",Drama,17000,882,826,0,8.21541,"OneTrueThing, director: Carl Franklin",Drama,11000,882,433,73,72478,"NeverLetMeGo, director: Mark Romanek",Drama,10000,882,844,132,7.21669,"DarkCity, director: Alex Proyas",Thriller Drama,3000,882,531,295,7.721,"RobinHood, director: Ridley Scott",Adventure Action,891,882,738,0,6.72020,"ScaryMovie, director: Malcolm D. Lee",Comedy Drama,31000,881,636,92,3.51006,"TrainingDay, director: Antoine Fuqua",Thriller Drama,18000,881,854,845,7.7170,"Turbo, director: David Soren",Animation,16000,881,463,13,6.52325,"BabyBoy, director: John Singleton",Thriller Drama,939,881,522,309,6.42353,"SoulPlane, director: Jessy Terrero",Comedy Drama,939,881,618,29,4.4818,"Turbulence, director: Robert Butler",Action,995,879,745,0,4.7428,"ConAir, director: Simon West",Action,12000,878,744,165,6.81841,"WithoutLimits, director: Robert Towne",Drama,2000,878,745,162,7.23944,"Saw, director: James Wan",Horror,2000,878,651,0,7.72404,"TheLastHouseontheLeft, director: Dennis Iliadis",Horror,956,878,616,29,6.61451,"Criminal, director: Ariel Vromen",Thriller Drama,10000,877,24,34,6.32124,"TheBrothersBloom, director: Rian Johnson",Drama,975,877,446,0,6.92011,"TheBlackHole, director: Gary Nelson",Action,889,877,160,20,5.92129,"Equilibrium, director: Kurt Wimmer",Thriller Drama,23000,876,722,110,7.52398,"TheTheoryofEverything, director: James Marsh",Drama,13000,876,149,120,7.71795,"PunchDrunkLove, director: Paul Thomas Anderson",Comedy Drama,11000,876,98,0,7.32302,"SouthlandTales, director: Richard Kelly",Comedy,1000,876,215,219,5.52819,"Sparkle, director: Salim Akil",Drama,1000,876,706,70,5.71126,"Ray, director: Taylor Hackford",Drama,904,876,748,138,7.72367,"MenandaBaby, director: Leonard Nimoy",Comedy Family,19000,875,801,12000,5.91937,"MadMoney, director: Callie Khouri",Comedy,939,875,290,144,5.81347,"BlastfromthePast, director: Hugh Wilson",Drama,3000,874,480,37,6.61124,"RideAlong, director: Tim Story",Comedy,2000,874,655,167,5.93863,"IntheBedroom, director: Todd Field",Drama,1000,874,783,143,7.52426,"TuckEverlasting, director: Jay Russell",Comedy Family,882,874,613,13,6.74294,"Baghead, director: Jay Duplass",Comedy Drama,962,873,98,157,6633,"DeathRace, director: Paul W.S. Anderson",Action,26000,872,805,545,6.43552,"ChainofCommand, director: Kevin Carraway",Action,2000,872,6,2,3.5482,"TheLeagueofExtraordinaryGentlemen, director: Stephen Norrington",Adventure Action,1000,872,845,45,5.81622,"Identity, director: James Mangold",Thriller Drama,1000,872,660,446,7.32252,"IAmWrath, director: Chuck Russell",Thriller Drama,1000,872,757,55,5.22455,"RaiseYourVoice, director: Sean McNamara",Comedy Family,1000,872,782,80,5.92551,"Flipped, director: Rob Reiner",Comedy Drama,1000,872,767,0,7.73733,"Thre, director: Robby Henson",Horror,973,872,201,9,5.11581,"TheMerchantofVenice, director: Michael Radford",Drama,14000,871,548,53,7.1183,"TheAdventuresofTintin, director: Steven Spielberg",Adventure Action,2000,871,845,14000,7.41846,"Ironclad, director: Jonathan English",Adventure Action,1000,870,520,9,6.2425,"BedtimeStories, director: Adam Shankman",Comedy Family,11000,869,495,163,6.11995,"DateMovie, director: Aaron Seltzer",Comedy Drama,3000,869,729,64,2.71113,"ScaryMovie, director: David Zucker",Comedy Drama,2000,869,807,119,5.11102,"BacktotheFuturePartII, director: Robert Zemeckis",Comedy,1000,869,690,0,7.8